{"$schema":"https://json-schema.org/draft/2020-12/schema","$id":"https://github.com/newcovid/nonebot-plugin-yijing/data/schemas/hexagrams.schema.json","title":"hexagrams","description":"King Wen sequence hexagram metadata.","type":"array","items":{"type":"object","additionalProperties":true,"required":["seq","name","symbol","lower_trigram","upper_trigram","palace_name","bits_bottom_up","binary_bottom_up","unicode_codepoint","tags"],"properties":{"seq":{"type":"integer","minimum":1,"maximum":64},"name":{"type":"string"},"symbol":{"type":"string"},"lower_trigram":{"type":"string"},"upper_trigram":{"type":"string"},"palace_name":{"type":"string"},"bits_bottom_up":{"type":"array","minItems":6,"maxItems":6,"items":{"type":"integer","enum":[0,1]}},"binary_bottom_up":{"type":"string","pattern":"^[01]{6}$"},"unicode_codepoint":{"type":"string","pattern":"^U\\+[0-9A-F]{4,6}$"},"tags":{"type":"array","items":{"type":"string"}}}}}
