[
  {
    "seq": 1,
    "name": "乾",
    "symbol": "䷀",
    "lower_trigram": "乾",
    "upper_trigram": "乾",
    "palace_name": "乾为天",
    "bits_bottom_up": [
      1,
      1,
      1,
      1,
      1,
      1
    ],
    "binary_bottom_up": "111111",
    "unicode_codepoint": "U+4DC0",
    "tags": []
  },
  {
    "seq": 2,
    "name": "坤",
    "symbol": "䷁",
    "lower_trigram": "坤",
    "upper_trigram": "坤",
    "palace_name": "坤为地",
    "bits_bottom_up": [
      0,
      0,
      0,
      0,
      0,
      0
    ],
    "binary_bottom_up": "000000",
    "unicode_codepoint": "U+4DC1",
    "tags": []
  },
  {
    "seq": 3,
    "name": "屯",
    "symbol": "䷂",
    "lower_trigram": "震",
    "upper_trigram": "坎",
    "palace_name": "水雷屯",
    "bits_bottom_up": [
      1,
      0,
      0,
      0,
      1,
      0
    ],
    "binary_bottom_up": "100010",
    "unicode_codepoint": "U+4DC2",
    "tags": []
  },
  {
    "seq": 4,
    "name": "蒙",
    "symbol": "䷃",
    "lower_trigram": "坎",
    "upper_trigram": "艮",
    "palace_name": "山水蒙",
    "bits_bottom_up": [
      0,
      1,
      0,
      0,
      0,
      1
    ],
    "binary_bottom_up": "010001",
    "unicode_codepoint": "U+4DC3",
    "tags": []
  },
  {
    "seq": 5,
    "name": "需",
    "symbol": "䷄",
    "lower_trigram": "乾",
    "upper_trigram": "坎",
    "palace_name": "水天需",
    "bits_bottom_up": [
      1,
      1,
      1,
      0,
      1,
      0
    ],
    "binary_bottom_up": "111010",
    "unicode_codepoint": "U+4DC4",
    "tags": []
  },
  {
    "seq": 6,
    "name": "讼",
    "symbol": "䷅",
    "lower_trigram": "坎",
    "upper_trigram": "乾",
    "palace_name": "天水讼",
    "bits_bottom_up": [
      0,
      1,
      0,
      1,
      1,
      1
    ],
    "binary_bottom_up": "010111",
    "unicode_codepoint": "U+4DC5",
    "tags": []
  },
  {
    "seq": 7,
    "name": "师",
    "symbol": "䷆",
    "lower_trigram": "坎",
    "upper_trigram": "坤",
    "palace_name": "地水师",
    "bits_bottom_up": [
      0,
      1,
      0,
      0,
      0,
      0
    ],
    "binary_bottom_up": "010000",
    "unicode_codepoint": "U+4DC6",
    "tags": []
  },
  {
    "seq": 8,
    "name": "比",
    "symbol": "䷇",
    "lower_trigram": "坤",
    "upper_trigram": "坎",
    "palace_name": "水地比",
    "bits_bottom_up": [
      0,
      0,
      0,
      0,
      1,
      0
    ],
    "binary_bottom_up": "000010",
    "unicode_codepoint": "U+4DC7",
    "tags": []
  },
  {
    "seq": 9,
    "name": "小畜",
    "symbol": "䷈",
    "lower_trigram": "乾",
    "upper_trigram": "巽",
    "palace_name": "风天小畜",
    "bits_bottom_up": [
      1,
      1,
      1,
      0,
      1,
      1
    ],
    "binary_bottom_up": "111011",
    "unicode_codepoint": "U+4DC8",
    "tags": []
  },
  {
    "seq": 10,
    "name": "履",
    "symbol": "䷉",
    "lower_trigram": "兑",
    "upper_trigram": "乾",
    "palace_name": "天泽履",
    "bits_bottom_up": [
      1,
      1,
      0,
      1,
      1,
      1
    ],
    "binary_bottom_up": "110111",
    "unicode_codepoint": "U+4DC9",
    "tags": []
  },
  {
    "seq": 11,
    "name": "泰",
    "symbol": "䷊",
    "lower_trigram": "乾",
    "upper_trigram": "坤",
    "palace_name": "地天泰",
    "bits_bottom_up": [
      1,
      1,
      1,
      0,
      0,
      0
    ],
    "binary_bottom_up": "111000",
    "unicode_codepoint": "U+4DCA",
    "tags": []
  },
  {
    "seq": 12,
    "name": "否",
    "symbol": "䷋",
    "lower_trigram": "坤",
    "upper_trigram": "乾",
    "palace_name": "天地否",
    "bits_bottom_up": [
      0,
      0,
      0,
      1,
      1,
      1
    ],
    "binary_bottom_up": "000111",
    "unicode_codepoint": "U+4DCB",
    "tags": []
  },
  {
    "seq": 13,
    "name": "同人",
    "symbol": "䷌",
    "lower_trigram": "离",
    "upper_trigram": "乾",
    "palace_name": "天火同人",
    "bits_bottom_up": [
      1,
      0,
      1,
      1,
      1,
      1
    ],
    "binary_bottom_up": "101111",
    "unicode_codepoint": "U+4DCC",
    "tags": []
  },
  {
    "seq": 14,
    "name": "大有",
    "symbol": "䷍",
    "lower_trigram": "乾",
    "upper_trigram": "离",
    "palace_name": "火天大有",
    "bits_bottom_up": [
      1,
      1,
      1,
      1,
      0,
      1
    ],
    "binary_bottom_up": "111101",
    "unicode_codepoint": "U+4DCD",
    "tags": []
  },
  {
    "seq": 15,
    "name": "谦",
    "symbol": "䷎",
    "lower_trigram": "艮",
    "upper_trigram": "坤",
    "palace_name": "地山谦",
    "bits_bottom_up": [
      0,
      0,
      1,
      0,
      0,
      0
    ],
    "binary_bottom_up": "001000",
    "unicode_codepoint": "U+4DCE",
    "tags": []
  },
  {
    "seq": 16,
    "name": "豫",
    "symbol": "䷏",
    "lower_trigram": "坤",
    "upper_trigram": "震",
    "palace_name": "雷地豫",
    "bits_bottom_up": [
      0,
      0,
      0,
      1,
      0,
      0
    ],
    "binary_bottom_up": "000100",
    "unicode_codepoint": "U+4DCF",
    "tags": []
  },
  {
    "seq": 17,
    "name": "随",
    "symbol": "䷐",
    "lower_trigram": "震",
    "upper_trigram": "兑",
    "palace_name": "泽雷随",
    "bits_bottom_up": [
      1,
      0,
      0,
      1,
      1,
      0
    ],
    "binary_bottom_up": "100110",
    "unicode_codepoint": "U+4DD0",
    "tags": []
  },
  {
    "seq": 18,
    "name": "蛊",
    "symbol": "䷑",
    "lower_trigram": "巽",
    "upper_trigram": "艮",
    "palace_name": "山风蛊",
    "bits_bottom_up": [
      0,
      1,
      1,
      0,
      0,
      1
    ],
    "binary_bottom_up": "011001",
    "unicode_codepoint": "U+4DD1",
    "tags": []
  },
  {
    "seq": 19,
    "name": "临",
    "symbol": "䷒",
    "lower_trigram": "兑",
    "upper_trigram": "坤",
    "palace_name": "地泽临",
    "bits_bottom_up": [
      1,
      1,
      0,
      0,
      0,
      0
    ],
    "binary_bottom_up": "110000",
    "unicode_codepoint": "U+4DD2",
    "tags": []
  },
  {
    "seq": 20,
    "name": "观",
    "symbol": "䷓",
    "lower_trigram": "坤",
    "upper_trigram": "巽",
    "palace_name": "风地观",
    "bits_bottom_up": [
      0,
      0,
      0,
      0,
      1,
      1
    ],
    "binary_bottom_up": "000011",
    "unicode_codepoint": "U+4DD3",
    "tags": []
  },
  {
    "seq": 21,
    "name": "噬嗑",
    "symbol": "䷔",
    "lower_trigram": "震",
    "upper_trigram": "离",
    "palace_name": "火雷噬嗑",
    "bits_bottom_up": [
      1,
      0,
      0,
      1,
      0,
      1
    ],
    "binary_bottom_up": "100101",
    "unicode_codepoint": "U+4DD4",
    "tags": []
  },
  {
    "seq": 22,
    "name": "贲",
    "symbol": "䷕",
    "lower_trigram": "离",
    "upper_trigram": "艮",
    "palace_name": "山火贲",
    "bits_bottom_up": [
      1,
      0,
      1,
      0,
      0,
      1
    ],
    "binary_bottom_up": "101001",
    "unicode_codepoint": "U+4DD5",
    "tags": []
  },
  {
    "seq": 23,
    "name": "剥",
    "symbol": "䷖",
    "lower_trigram": "坤",
    "upper_trigram": "艮",
    "palace_name": "山地剥",
    "bits_bottom_up": [
      0,
      0,
      0,
      0,
      0,
      1
    ],
    "binary_bottom_up": "000001",
    "unicode_codepoint": "U+4DD6",
    "tags": []
  },
  {
    "seq": 24,
    "name": "复",
    "symbol": "䷗",
    "lower_trigram": "震",
    "upper_trigram": "坤",
    "palace_name": "地雷复",
    "bits_bottom_up": [
      1,
      0,
      0,
      0,
      0,
      0
    ],
    "binary_bottom_up": "100000",
    "unicode_codepoint": "U+4DD7",
    "tags": []
  },
  {
    "seq": 25,
    "name": "无妄",
    "symbol": "䷘",
    "lower_trigram": "震",
    "upper_trigram": "乾",
    "palace_name": "天雷无妄",
    "bits_bottom_up": [
      1,
      0,
      0,
      1,
      1,
      1
    ],
    "binary_bottom_up": "100111",
    "unicode_codepoint": "U+4DD8",
    "tags": []
  },
  {
    "seq": 26,
    "name": "大畜",
    "symbol": "䷙",
    "lower_trigram": "乾",
    "upper_trigram": "艮",
    "palace_name": "山天大畜",
    "bits_bottom_up": [
      1,
      1,
      1,
      0,
      0,
      1
    ],
    "binary_bottom_up": "111001",
    "unicode_codepoint": "U+4DD9",
    "tags": []
  },
  {
    "seq": 27,
    "name": "颐",
    "symbol": "䷚",
    "lower_trigram": "震",
    "upper_trigram": "艮",
    "palace_name": "山雷颐",
    "bits_bottom_up": [
      1,
      0,
      0,
      0,
      0,
      1
    ],
    "binary_bottom_up": "100001",
    "unicode_codepoint": "U+4DDA",
    "tags": []
  },
  {
    "seq": 28,
    "name": "大过",
    "symbol": "䷛",
    "lower_trigram": "巽",
    "upper_trigram": "兑",
    "palace_name": "泽风大过",
    "bits_bottom_up": [
      0,
      1,
      1,
      1,
      1,
      0
    ],
    "binary_bottom_up": "011110",
    "unicode_codepoint": "U+4DDB",
    "tags": []
  },
  {
    "seq": 29,
    "name": "坎",
    "symbol": "䷜",
    "lower_trigram": "坎",
    "upper_trigram": "坎",
    "palace_name": "坎为水",
    "bits_bottom_up": [
      0,
      1,
      0,
      0,
      1,
      0
    ],
    "binary_bottom_up": "010010",
    "unicode_codepoint": "U+4DDC",
    "tags": []
  },
  {
    "seq": 30,
    "name": "离",
    "symbol": "䷝",
    "lower_trigram": "离",
    "upper_trigram": "离",
    "palace_name": "离为火",
    "bits_bottom_up": [
      1,
      0,
      1,
      1,
      0,
      1
    ],
    "binary_bottom_up": "101101",
    "unicode_codepoint": "U+4DDD",
    "tags": []
  },
  {
    "seq": 31,
    "name": "咸",
    "symbol": "䷞",
    "lower_trigram": "艮",
    "upper_trigram": "兑",
    "palace_name": "泽山咸",
    "bits_bottom_up": [
      0,
      0,
      1,
      1,
      1,
      0
    ],
    "binary_bottom_up": "001110",
    "unicode_codepoint": "U+4DDE",
    "tags": []
  },
  {
    "seq": 32,
    "name": "恒",
    "symbol": "䷟",
    "lower_trigram": "巽",
    "upper_trigram": "震",
    "palace_name": "雷风恒",
    "bits_bottom_up": [
      0,
      1,
      1,
      1,
      0,
      0
    ],
    "binary_bottom_up": "011100",
    "unicode_codepoint": "U+4DDF",
    "tags": []
  },
  {
    "seq": 33,
    "name": "遁",
    "symbol": "䷠",
    "lower_trigram": "艮",
    "upper_trigram": "乾",
    "palace_name": "天山遁",
    "bits_bottom_up": [
      0,
      0,
      1,
      1,